{"schema_version":"local-monitor-comparison-create.request.v1","cohorts":{"a":["018f0000-0000-7000-8000-000000000001"],"b":["018f0000-0000-7000-8000-000000000002"]},"include_archived":false,"selection_sha256":"1111111111111111111111111111111111111111111111111111111111111111","preview_revision":"2222222222222222222222222222222222222222222222222222222222222222"}